{
  "schema_id": "ctxvault.privacy-preflight-receipt/v1",
  "contract_state": "experimental",
  "receipt_id": "privacy_preflight_20260430t000000z_1d441f56",
  "selection_ref": "context-selection://1d441f56f6f5c597",
  "selection_mode": "explicit_slice_refs",
  "target_kind": "wiki.markdown-workstream",
  "query": "release safety",
  "workstream_ref": "workstream://ws_20260421_ctxvault_schema",
  "selected_slice_refs": [
    "slice://knowledge/know_proj_ctxvault_profile_v1#markdown_paragraph/531777-8aa2ff817b30"
  ],
  "selected_slice_count": 1,
  "source_refs": [
    "knowledge://know_proj_ctxvault_profile_v1"
  ],
  "decision": "allow",
  "highest_severity": "none",
  "highest_sensitivity": "internal",
  "privacy_classes": {
    "searchable_plain": 1
  },
  "reasons": [],
  "candidate_content_sha256": "982e4c52ca54ef380c34bec36561a0adbbc1c4237596d42562796d0695f7d176",
  "redacted_content_sha256": "982e4c52ca54ef380c34bec36561a0adbbc1c4237596d42562796d0695f7d176",
  "token_estimate": 42,
  "projection_gate": {
    "required_for_selected_slice_projection": true,
    "allowed_to_write": true,
    "blocking_decisions": [
      "block"
    ]
  },
  "privacy_scan": {
    "source": "context-selection:wiki.markdown-workstream",
    "decision": "allow",
    "highest_severity": "none",
    "reasons": [],
    "summary": {
      "total_findings": 0,
      "returned_findings": 0,
      "truncated": false,
      "severity_counts": {},
      "category_counts": {}
    },
    "findings": [],
    "scanned_at": "2026-04-30T00:00:00+00:00"
  },
  "selected_slices": [
    {
      "slice_ref": "slice://knowledge/know_proj_ctxvault_profile_v1#markdown_paragraph/531777-8aa2ff817b30",
      "source_ref": "knowledge://know_proj_ctxvault_profile_v1",
      "source_object_kind": "knowledge_artifact",
      "slice_kind": "markdown_paragraph",
      "title": "CtxVault Profile (paragraph)",
      "privacy_class": "searchable_plain",
      "sensitivity": "internal",
      "redaction_state": "none",
      "token_estimate": 42,
      "redacted_preview": "CtxVault is a local-first context and evidence layer for deterministic assistant handoff."
    }
  ],
  "created_at": "2026-04-30T00:00:00+00:00"
}
